{
    
    "date": "2018-05-21T20:32:10.20+01:00",
    "e-mail": "e@tracker.de",
    "hostname": "etracker.com",
    "IPv4": "62.201.164.110",
    "IPv6": "2a00:1450:4001:821::200e",
    "URI": "https://www.etracker.com/",
    "JSON-pointer": "/foo/0",
    "Relative-JSON-pointer": "1#"
    
    
}